title,views,posted
"Prof Blade Nzimande on Fees Must Fall, Jacob Zuma, MK Party, NSFAS, Mandela, Mbeki, Zuma, Ramaphosa",20000.0,4 hours 
'Mbalula is my brother' — Tony Yengeni,6800.0,1 day 
"Tony Yengeni on Fikile Mbalula, Jacob Zuma & MK Party, 'GNU', Chris Hani, Phala Phala, ANC, CR17",95000.0,2 days 
‘GNU won’t do more.’ — Prince Mashele,4300.0,3 days 
"Prince Mashele on ‘GNU’, ANC, MK Party, Jacob Zuma, DA, Ndlozi, Julius Malema, EFF, Thabo Mbeki",143000.0,4 days 
'Zuma lost faith in Zondo Commission.' — Adv Muzi Sikhakhane,16000.0,5 days 
"Adv Muzi Sikhakhane on Chris Hani, new book, Jacob Zuma, Zondo, State Capture, Black Advocates, Law",125000.0,6 days 
"Ramaphosa begs SACP to stay: Solly Mapaila, Panyaza Lesufi, Tony Yengeni, ANC Jan 8",40000.0,8 days 
"What’s SHAKING South African politics in 2025? ‘GNU’, ANC v DA v EFF v MK",22000.0,9 days 
"Funniest Bloopers on SMWX 😂 | Sizwe Mpofu-Walsh, Pandor, Thembekwayo, Matshiqi, Mkhwebane",9900.0,2 weeks 
"Teresa Oakley-Smith: ANC history, 'GNU', BEE, school racism, Nelson Mandela, Jacob Zuma & MK Party",33000.0,3 weeks 
"Reuben Brigety: Lady R, AGOA, BRICS, Israel-Palestine, Gaza, 'GNU'",29000.0,4 weeks 
"Mmusi Maimane: 'GNU', BOSA, Parliament, ANC, DA, Zuma & MK Party, Ramaphosa, spaza shops",74000.0,1 month 
"EFF, SACP & MKP Events: EFF NPA, SACP Congress, MKP anniversary, Malema, Mbeki, Ndlozi, Zuma, ‘GNU’",67000.0,1 month 
"Songezo Zibi: 2024 Election, ANC, ‘GNU’ negotiations, MK Party, SCOPA, Rise Mzansi, Parliament",35000.0,1 month 
"Vusi Thembekwayo: Money, Jacob Zuma & MKP, Masterclass, Spaza shops, Ramaphosa, podcast, motivation",256000.0,1 month 
"Gogo Matshiqi: 'GNU', Zuma & MK Party, ANC-DA, Ramaphosa, SACP, Floyd Shivambu, EFF, Julius Malema",204000.0,1 month 
"Helen Zille: Jacob Zuma & MK Party, ‘GNU’, early life, biography, coalitions, Ramaphosa, Mashatile",158000.0,1 month 
"Kgalema Motlanthe: Thabo Mbeki, Robben Island, ‘GNU’, Mandela, NUM, CODESA, Jacob Zuma, Ramaphosa",114000.0,1 month 
"John Hlophe: JSC, 'GNU', Zuma & MK Party, Law, Constitution, life story, Judiciary, impeachment",149000.0,1 month 
"Justice Albie Sachs: Life story, Oliver Tambo, ANC history, Apartheid, SA Constitution, Concourt",17000.0,1 month 
"Mighti Jamie: Concourt Phala Phala case, ‘GNU’, Floyd Shivambu, MK Party, SA economy, EFF, Ramaphosa",85000.0,1 month 
"Tessa Dooms: 'GNU', ANC-DA, Jacob Zuma & MK Party, EFF, Donald Trump, Left vs Right",54000.0,1 month 
"Lukhona Mnguni: 'GNU', Botswana, Jacob Zuma & MK Party, ANC-DA, EFF, Floyd Shivambu, 2024 Election",92000.0,1 month 
"Ongama Mtimka: ‘GNU’, ANC-DA, Jacob Zuma & MK Party, Julius Malema & EFF, Floyd Shivambu, Ndlozi",62000.0,2 months 
"Darren Campher: Jacob Zuma & MK Party, EFF, 'GNU', ANC-DA, BELA Act march",96000.0,2 months 
"Samkele Maseko: ANC-DA, EFF, Jacob Zuma & MK Party, Gavin Watson, Cyril Ramaphosa, Helen ZIlle, GNU",204000.0,2 months 
Will MK Party and EFF unite?,89000.0,2 months 
"Brian Molefe: ‘GNU’, Eskom, EFF, Guptas, Zuma & MK Party, State Capture, Shivambu, SA economy",227000.0,2 months 
"Fasiha Hassan: 'GNU', ANC-DA, SACP, BRICS, Israel-Palestine, JSC, Fees Must Fall, US election",57000.0,2 months 
"Thembekile Mrototo on 'GNU', Big Debate, Unfollowed, 2024 election, ANC-DA, Newzroom Afrika, eNCA",44000.0,2 months 
"Thandi Modise on 'GNU', BRICS, Zuma and MK Party, DRC war, Russia, Ranking SA Presidents, ANC, SANDF",131000.0,2 months 
"Floyd Shivambu on EFF, Jacob Zuma, State Capture, Julius Malema, MK Party, 'GNU', Ramaphosa, BRICS",896000.0,2 months 
"Dr Kgosientsho Ramokgopa on loadshedding, 'GNU', Eskom, ANC, de Ruyter, Mbalula, Tshwane, Ramaphosa",86000.0,2 months 
"Israel vs Iran? Middle East War explained | Lebanon, Yemen, Gaza",29000.0,2 months 
"Assessing ‘GNU’ after 100 days | ANC, NHI, Helen Zille, Mbalula, DA, Ramaphosa, BELA, economy",27000.0,2 months 
"Busisiwe Mkhwebane on EFF resignation, 'GNU', life and upbringing, Section 194 Committee, MK Party",258000.0,3 months 
Panyaza Lesufi vs Fikile Mbalula? Feud over ‘GNU’ and ANC’s future,100000.0,3 months 
"Rekgotsofetse Chikane on ANC-DA, MK Party, 2024 election, Jacob Zuma, civil society, EFF",94000.0,3 months 
"Panyaza Lesufi on 'GNU', Helen Zille, Tshwane, ANC, EFF, Jacob Zuma & MK Party, Solly Mapaila, BELA",305000.0,3 months 
"Equal Education's Noncedo Madubedube on BELA Act, 'GNU', budget cuts, language policy, SGB powers",13000.0,3 months 
"Mark Heywood on ‘GNU’, ANC, listeriosis class action, food safety, Tiger Brands, Cyril Ramaphosa",13000.0,3 months 
Apartheid's Architect: Biography of Hendrik Verwoerd,74000.0,3 months 
Elon Musk meets Cyril Ramaphosa as Starlink scrambles for Africa,36000.0,3 months 
Orania’s dark history: the story of South Africa’s whites-only town,72000.0,3 months 
"Thabo Mbeki blasts ANC, calls for urgent ‘renewal’",40000.0,3 months 
Pravin Gordhan: Reflecting on his political life,14000.0,3 months 
"BELA Bill controversy explained: ANC-DA tensions, Cyril Ramaphosa, SA education",36000.0,3 months 
"Isobel Frye on ‘GNU’, Universal Basic Income, Social Grants, Poverty, Welfare, ANC",28000.0,4 months 
Ranking Left vs Right in SA politics: ANC vs MK Party vs EFF vs DA,27000.0,4 months 
"Prof Tshepo Madlingozi on SA Constitution, Human rights, racism in schools, BELA Bill, SAHRC",30000.0,4 months 
"Bongani Baloyi on joining MK Party, 'GNU', Floyd Shivambu, Helen Zille, EFF, ANC-DA",115000.0,4 months 
"Tshwane Mayor Cilliers Brink on 'GNU', Motion of no confidence, ActionSA, ANC-DA, EFF & MK Party",30000.0,4 months 
"Will Tripartite Alliance split? | Solly Mapaila, SACP, Fikile Mbalula, ANC, 'GNU', COSATU, MK Party",71000.0,4 months 
"Solly Mapaila on 'GNU', Jacob Zuma & MK Party, Cyril Ramaphosa, Floyd Shivambu, EFF, SACP, Apartheid",212000.0,4 months 
"Keith Engel on Wealth Tax, ‘GNU’, NHI, SARS, ANC tax policy, SA Tax Indaba",24000.0,4 months 
"Clement Manyathela on ‘GNU’, John Steenhuisen, Cyril Ramaphosa, MK Party, Trevor Noah, Adele, SABC",99000.0,4 months 
"Naledi Pandor on 'GNU', Palestine-Israel, ICJ, Thabo Mbeki, Jacob Zuma & MK, Cyril Ramaphosa",368000.0,4 months 
"Julius Malema strikes back: EFF reacts to Floyd Shivambu & MK Party, Mkhwebane, Ndlozi, Jacob Zuma",246000.0,4 months 
"Tragic stabbing at South Africa’s Overberg High School | Deveney Nel, Reza Saloojee, Bayanda Walaza",83000.0,5 months 
"Joburg Mayor Kabelo Gwamanda steps down, what next for the city? Dada Morero in?",25000.0,5 months 
"Chidimma Adetshina withdraws from Miss SA 2024, issues statement after fraud allegations",60000.0,5 months 
"JJ Tabane on Jacob Zuma interview, Pastor Mboro, Gayton McKenzie, Julius Malema, Helen Zille, ‘GNU’",475000.0,5 months 
"Pastor Mboro ARRESTED for wielding weapon in school, church set alight",164000.0,5 months 
"Herman Mashaba on ‘GNU’, Helen Zille remarks, ANC, Joburg metro, Gauteng and ActionSA",51000.0,5 months 
"ANC expels Jacob Zuma, appeals MK Party trademark court defeat, NEC",28000.0,5 months 
"Unfair Attacks on Miss SA 2024 Finalist | Gayton Mckenzie, Pearl Thusi, Elon Musk, Chidimma, GNU",76000.0,5 months 
"Is Joburg in crisis? | Mayor Gwamanda, R200 electricity tariff, ActionSA, Morero, COJ infrastructure",13000.0,5 months 
Who's the next ANC leader? | Mashatile vs Mantashe vs Mbalula and more…,34000.0,5 months 
"William Gumede on ‘GNU’, SOEs, Cyril Ramaphosa, GNU economics, ANC v DA v MK v EFF",35000.0,5 months 
"Joburg mayor shakeup? | Cyril Ramaphosa’s parliament reply, VBS trial, Mashaba, Gwamanda",41000.0,5 months 
"Darren Campher on 'GNU', VBS, Phala Phala, TikTok, VF+, Privatisation, SA Racism, MK Party & EFF",58000.0,5 months 
MPs react to Ramaphosa Parliament Speech | Malema vs Hlophe vs Steenhuisen vs McKenzie vs Mokonyane,185000.0,5 months 
"Ramaphosa speech to Parliament | Zuma DC, Donald Trump, MK Party and EFF",38000.0,6 months 
"Explosive VBS affidavit: EFF, ANC, Treasury, Floyd Shivambu, Tshifhiwa Matodzi, Julius Malema",157000.0,6 months 
Gayton McKenzie outs R72 million funding list | Parliament elects ‘GNU’ Chairs,102000.0,6 months 
"Can Dr John Hlophe serve the Judicial Service Commission (JSC)? MK party, ‘GNU’",38000.0,6 months 
Should SA revamp its Constitution?,23000.0,6 months 
"Cyril Ramaphosa's cabinet begins | 'GNU', Gauteng government, Cabinet Lekgotla, MK Party John Hlophe",81000.0,6 months 
What now for MK Party & EFF? Opposition in the 'GNU' era,143000.0,6 months 
Cyril Ramaphosa announces new Cabinet! Unpacking final post-election ANC-DA+ deal,108000.0,6 months 
"Adv Muzi Sikhakhane on ANC-DA Cabinet, ‘GNU’, SA Constitution, MK Party, Zuma, Mbeki, Ramaphosa",381000.0,6 months 
"Another ""GNU"" twist? | Cabinet, ANC, DA, Ramaphosa-Steenhuisen letter, MK Party & EFF, Helen Zille",138000.0,6 months 
Why land still matters in South Africa: how SA became so segregated,46000.0,6 months 
"'GNU' talks stall: John Hlophe joins MK Party, Ramaphosa Cabinet, ANC-DA spat, Gauteng deadlock, EFF",157000.0,6 months 
"Mighti Jamie on Cabinet, DA, ""GNU"" coalition, Ramaphosa's Inauguration, racism, Renaldo Gouws",23000.0,6 months 
Renaldo Gouws exposed: DA MP in crisis over racism claims,56000.0,6 months 
"""GNU"" in ICU? | ANC-DA spat, Ramaphosa Cabinet, Mbalula, Zille, MK Party, Parliament, VF+ & PAC",118000.0,6 months 
"Aubrey Matshiqi on Cabinet, Helen Zille, Renaldo Gouws, ‘GNU’, Zuma & MK Party, SA Constitution",289000.0,6 months 
"Prof Pierre de Vos on Phala Phala, ANC-DA ""GNU"" pact, SA Constitution debate, National Assembly",74000.0,7 months 
"Dr Ntando Sindane on ANC-DA+ coalition, Constitution, EFF, Jacob Zuma & MK Party, Steve Biko, racism",255000.0,7 months 
"MPs react to ANC-DA coalition: Ramokgopa, Gwarube, Niehaus, Maimane, Zungula, Kwankwa, Hlazo-Webster",177000.0,7 months 
"Reacting to coalitions: Speaker, President, ANC-DA, MK & EFF, Western Cape, Parliament, Ramaphosa",22000.0,7 months 
"Reacting to ANC-DA+ coalition: “GNU”, MK Party, KZN, EFF, National Assembly Speaker, Ramaphosa",134000.0,7 months 
"How will National Assembly Vote? | Parliament, ANC-DA, EFF, MK Party, Didiza",16000.0,7 months 
"How will National Assembly Vote? | Parliament, ANC-DA, EFF, MK Party, Didiza",18000.0,7 months 
"Reacting to EFF Presser: Julius Malema, Zuma & MK Party, ANC, Ramaphosa, Parliament first sitting",32000.0,7 months 
"Reacting to coalition talks: Parliament First Sitting, GNU, EFF, MK Party, ANC, DA, GNU, Speaker",57000.0,7 months 
Why Phala Phala will haunt Cyril Ramaphosa and “Government of National Unity”,79000.0,7 months 
"“Government of National Unity”? DA-ANC, Zuma & MK party, EFF, SA economy, Parliament first sitting",125000.0,7 months 
"""Government of National Unity""? Coalitions, Parliament first sitting, MK Party, ANC-DA, EFF, Zondo",79000.0,7 months 
"Aubrey Matshiqi on Ramaphosa, ANC, Zuma & MK Party, EFF, DA, 2024 Election, Coalitions, Parliament",276000.0,7 months 
"Coalition analysis: ANC NEC, Unity Government, ANC-DA, Cyril Ramaphosa, EFF, MK Party, IFP, PA",73000.0,7 months 
Reacting to coalitions talks | ANC vs DA vs MK Party vs EFF vs IFP,51000.0,7 months 
"Reacting to coalitions: ANC-DA, EFF, MK, IFP and the 2024 election",19000.0,7 months 
"Unpacking coalition talks: ANC-DA vs EFF-MK, IFP, PA and the 2024 election",68000.0,7 months 
"Reacting to coalition talks | ANC-DA, EFF, MK, 2024 elections, Election Results",190000.0,7 months 
Reacting to DRAMATIC Election Results: ANC vs DA vs MK Party vs EFF,123000.0,7 months 
Reacting to Election Results: Patriotic Alliance & Northern Cape,13000.0,7 months 
Reacting to the Election Results & Coalitions: ANC vs DA vs MK Party vs EFF,45000.0,7 months 
Reacting to the Election Results: ANC vs DA vs MK Party vs EFF,14000.0,7 months 
Reacting to the Election Results: ANC vs DA vs MK Party vs EFF,45000.0,7 months 
Reacting to the MASSIVE Election Results: ANC vs DA vs MK Party vs EFF,174000.0,7 months 
Reacting to the Election Results: ANC vs DA vs MK Party vs EFF,34000.0,7 months 
Reacting to the Election Results: ANC vs DA vs MK Party vs EFF,33000.0,7 months 
"Tasneem Essop on 2024 election, ANC, DA, EFF, Zuma & MK Party, Election Day",13000.0,7 months 
My final election expectations: ANC vs DA vs EFF vs MK Party,56000.0,7 months 
"Mbeki, Zuma and Ramaphosa make closing election arguments",46000.0,7 months 
"Aubrey Matshiqi on Jacob Zuma & MK Party, Thabo Mbeki, Ramaphosa, Julius Malema, 2024 Election",235000.0,7 months 
Media suppressing Zuma and MK Party?,19000.0,7 months 
"Patriotic Alliance and ""The Coloured Vote"" | McKenzie, Kunene, EFF, MK Party, 2024 election",33000.0,7 months 
🗳️ Election Update: ANC strikes back in polls,35000.0,7 months 
"ConCourt Bars Zuma from Parliament | MK Party vs IEC, 2024 election",64000.0,7 months 
"Is “Moonshot Pact” dead? | Steenhuisen, DA, IFP, ANC-EFF coalition, KZN, Multiparty Charter",21000.0,7 months 
"What is the National Health Insurance (NHI) Bill? | Ramaphosa, ANC, private healthcare, corruption",35000.0,8 months 
"Prof David Monyae on Africa, China, SADC, Africa Free Trade, borders, passports & visas, AU",9700.0,8 months 
"Will ANC lose Gauteng? | 2024 election, Thabo Mbeki, DA, EFF, Tshwane, Ekhuruleni, Johannesburg",28000.0,8 months 
"Terror Lekota on Zuma and MK Party, Robben Island, Cyril Ramaphosa allegations, COPE, ANC",203000.0,8 months 
DA flag burning advert stirs controversy...,13000.0,8 months 
"Jacob Zuma vs IEC: ConCourt hearing preview | MK Party List, parliament, prison sentence & remission",60000.0,8 months 
"Mighti Jamie on Jacob Zuma, MK Party, ConCourt hearing, IEC, parliament, prison sentence & remission",49000.0,8 months 
EFF endorsed by Abahlali Basemjondolo,19000.0,8 months 
Thabo Mbeki and Kgalema Motlanthe campaign for ANC,32000.0,8 months 
"🥊Election Debate: ANC vs DA on SA economy, Phala Phala, racism, loadshedding, affirmative action",49000.0,8 months 
"IFP President Velenkosi Hlabisa on AmaZulu Royal Succession, Zuma & MK Party, Steenhuisen, ANC, KZN",27000.0,8 months 
"Jan Moganwa on Jacob Zuma, Julius Malema, ANC-EFF-MK coalition, Moonshot Pact, CITIZANS, Ramaphosa",53000.0,8 months 
"Mmusi Maimane on Julius Malema, John Steenhuisen, Cyril Ramaphosa, Jacob Zuma & MK Party, 2024 vote",128000.0,8 months 
Why Western Cape Independence is Foolish and Delusional…,30000.0,8 months 
Julius Malema responds to my question on Cyril Ramaphosa...,156000.0,8 months 
Jacob Zuma v ANC: MK Party triumphs in high-stakes trademark & logo court case | 2024 election,49000.0,8 months 
Chris Hani: the tragic story of a liberation hero,65000.0,8 months 
"Zuma vs everyone: Unpacking MK Party election court cases | Electoral court, IEC, Trademark",43000.0,9 months 
"Siviwe Gwarube on ANC-DA coalition, Zuma & MK Party, EFF, Parliament, gender equality, Steenhuisen",41000.0,9 months 
"Dr Corne Mulder on Apartheid, Mapisa-Nqakula, 2024 elections, Zuma, Cape Independence, Ramaphosa",213000.0,9 months 
Zuma vs IEC: MK Party scores major victory in Electoral Court case,119000.0,9 months 
🗳️ Election Update: Will ANC fall below 50%? | Historical data and polls,46000.0,9 months 
"Andile Mngxitama on MK Party, Julius Malema, Thabo Mbeki, Markus Jooste, Jacob Zuma, 2024 election",285000.0,9 months 
"Mapisa-Nqakula to face charges | corruption allegations, arrest, ANC, NPA, interdict",81000.0,9 months 
"Zimbabwe Opposition Crisis? | CCC, Mnangagwa, elections, Nelson Chamisa, ZANU PF, Gabon",11000.0,9 months 
"2024 ELECTIONS: All you need to know | 3 Ballots, seats, IEC, signatures, how to vote, voting myths",10000.0,9 months 
"Prof Achille Mbembe on racism, Apartheid, Democracy in SA, 2024 election, EFF, Universities, FIDEMO",19000.0,9 months 
Lukhona Mnguni on whether smaller parties matter in the 2024 election,7700.0,9 months 
"🥊Election Debate: BOSA vs ATM on immigration, education, Eskom & SOEs, funding, coalitions, economy",10000.0,9 months 
South Africa at 30: has SA failed to live up to its promise? (with Lukhona Mnguni),13000.0,9 months 
Unpacking 19 BIG African elections in 2024 (with Mighti Jamie),2400.0,9 months 
"Kenny Kunene on coalitions, crime, 2024 elections, Patriotic Alliance, transport, death penalty",64000.0,10 months 
"Vuyo Zungula on Phala Phala, Parliament, SA Economy, Zuma & MK Party, 2024 elections",68000.0,10 months 
"🥊 Election Debate: ActionSA vs Rise Mzansi on Oppenheimers, immigration, coalitions, economy, jobs",15000.0,10 months 
"Bantu Holomisa on Pravin Gordhan, SAA, Ranking SA Presidents, Zuma & MK Party, Eskom, 2024 election",102000.0,10 months 
"Adv Tshidiso Ramogale on Harvard journey, SA Constitution, Advocacy tips, ICJ case, Adv Ngcukaitobi",9300.0,10 months 
"Roger Jardine on SA nuclear weapons, Ramaphosa, cadre deployment, state v private ownership",10000.0,10 months 
"Zuma vs Mbeki: the epic chess game that defined South Africa, from ANC to MK Party",209000.0,10 months 
"Jan Moganwa on land, big business, BEE, CITIZANS, banking, AfriForum, transformation, education",26000.0,10 months 
ANC vs DA manifesto breakdown | Comparing plans for the 2024 election (with Tessa Dooms),15000.0,10 months 
"Gareth Cliff on Julius Malema, CliffCentral, HHP & Riky Rick, Thabo Mbeki, Free speech, broadcasting",148000.0,10 months 
"Shadrack Kubyane on fake foods, raising millions, agriculture, Blockchain, land reform, eFama App",18000.0,10 months 
Mashatile vs Ramaphosa: Is the media BIASED? (with Mighti Jamie),24000.0,10 months 
"JJ Tabane on Jacob Zuma & MK Party, SONA 2024, ANC & Ramaphosa, Mbeki, Mogoeng, Phakeng",397000.0,11 months 
"Penny Lebyane on ANC, broadcasting, social media, gender inequality, racism",10000.0,11 months 
"🗳️Election Update: SONA review, Loadshedding stage 6, New polls, ANC declining?",31000.0,11 months 
"EFF manifesto launch: Reacting to Julius Malema speech, loadshedding stage 6, SONA, 2024 elections",50000.0,11 months 
"Are MPs abusing Parliament? | Cyril Rampahosa's SONA preview, electoral reform (with Tessa Dooms)",10000.0,11 months 
"Gogo Aubrey Matshiqi on Jacob Zuma, Thabo Mbeki, AmaZulu royal succession, MK party, ANC, Ramaphosa",508000.0,11 months 
"Elections expert reveals youth voters’ power, voter registration weekend, 2024 Elections Date",5400.0,11 months 
"Prof Somadoda Fikeni on 30 years of democracy, corruption, building a capable state, PhD tips",25000.0,11 months 
"🥊 Election Debate: EFF vs PA on Immigration, Land, Unemployment, Constitution, Corruption",56000.0,11 months 
ICJ rules for South Africa: a defeat for Israel?,11000.0,11 months 
"Michael Beaumont on Jacob Zuma, Immigration, ActionSA, SASSA Grants, EFF, Multiparty Charter",34000.0,11 months 
Minister Ronald Lamola on South Africa’s Genocide case against Israel at the ICJ,12000.0,11 months 
Ranking SA’s Presidents: Mandela vs Mbeki vs Motlanthe vs Zuma vs Ramaphosa (tier list),69000.0,1 year 
"🗳️ Election Update: ANC January 8, Jacob Zuma MK Party & Ace Magashule, Mbalula, Opposition roundup",40000.0,1 year 
South Africa vs Israel at ICJ: Analysing SA's case at the International Court of Justice on Gaza,19000.0,1 year 
"Dan Corder on Helen Zille, Rand Manipulation, The Issue with Dan Corder, TikTok, SA 2024 election",35000.0,1 year 
"The immigration debate | Aaron Motsoaledi White Paper, Refugee Act, ZEP (with Mighti Jamie)",12000.0,1 year 
"Dr Max Price on #RhodesMustFall, #FeesMustFall, new book: Statues and Storms, UCT and NSFAS",15000.0,1 year 
"Wouter Kellerman on winning Grammys, Bayethe, Diamond Platnumz, Shape of You, Ndlovu Youth Choir",1100.0,1 year 
"Dr Ongama Mtimka on 2024 Election, Jacob Zuma, cadre deployment, Ramaphosa, opposition politics",209000.0,1 year 
"Adv Dali Mpofu on his early years, law, detention, Apartheid, solitary confinement, courts, EFF",158000.0,1 year 
"A failed state of democracy in South Africa? | racism, land reform, 2024 election (with Tessa Dooms)",13000.0,1 year 
"Collen Malatji on Julius Malema, rand manipulation, Phala Phala, 2024 Elections, ANC liquidation",50000.0,1 year 
How Jacob Zuma’s announcement of MK Party could shake up SA’s 2024 election…,202000.0,1 year 
ANC vs Ezulweni Investments: R150 MILLION battle over election banners,27000.0,1 year 
"Matšhela Koko on battle vs NPA, how to fix Eskom load shedding, state capture, Zondo, Ramaphosa",157000.0,1 year 
ConCourt deals blow to independent candidates | SA 2024 election update (with Mighti Jamie),5500.0,1 year 
"Dr Pedro Mzileni on being victimised for teaching about racism, academic freedom, & UFS",59000.0,1 year 
Parliament vs the Constitution? How the sub-judice rule harms democracy (with Sello Phahle),3600.0,1 year 
"ANC + DA coalition? 👀 | Cyril Ramaphosa vs Paul Mashatile, SA 2024 election, Judge Zondo and NPA",36000.0,1 year 
"""SA is STILL captured"" I Stage 6 loadshedding, Matshela Koko vs NPA, Cyril Ramaphosa legacy",119000.0,1 year 
Zondo guns for Zuma,32000.0,1 year 
Will ANC fall below 50%? 📉 | South Africa 2024 election update.,39000.0,1 year 
"SA 2024 Election: What's at stake?, Civil Society and 2024, A Black Afriforum? (with Tessa Dooms)",12000.0,1 year 
"""Crime is counter-revolutionary"" | Upbringing, PhD journey, joining EFF, Crime in Johannesburg",37000.0,1 year 
Medium-term budget | New Public Protector | EFF campus takeover? (with Mighti Jamie),16000.0,1 year 
What’s causing coups in Africa?,17000.0,1 year 
"“Remember Steve Biko!” | Public Protector impeachment, Joburg fires, Cape floods, 2024 Election",58000.0,1 year 
"South Africa's 2024 election: All you need to know | coalitions, provinces, election date, vote for?",37000.0,1 year 
"""Coloured is a culture, not a race"" | New book, Heritage Day, Coloured history in South Africa",7700.0,1 year 
"""SA needs fundamental change"" | BEE failed? Rise Mzansi, Phala Phala, abolishing townships",31000.0,1 year 
Another Whitewash? Unpacking SARB Phala Phala Statement on President Ramaphosa (with Mighti Jamie),14000.0,1 year 
"Can Southern Africa Become a Superpower? | BRICS Summit, Zimbabwe Election 2023, (Stephen Chan)",17000.0,1 year 
"Elon Musk vs Julius Malema | Is outrage over ""kill the Boer"" chant warranted?",31000.0,1 year 
Zimbabwe's 2023 Election: All You Need to Know | Mnangagwa vs Chamisa? (with Mighti Jamie),97000.0,1 year 
"""Ramaphosa won't survive"" | EFF 10th anniversary, ANC Youth League, Life story, Julius Malema",442000.0,1 year 
"Will ANC fall below 50%? | EFF 10th Anniversary, Mbalula vs Mantashe, Phala Phala, PhD advice tips",75000.0,1 year 
"""We must own the economy"": New book, AKA, Slikour on Life, Skwatta Kamp, SA hip-hop history",11000.0,1 year 
Whitewash? Unpacking Public Protector's Phala Phala Report on President Ramaphosa,56000.0,1 year 
A tribute to Eusebius McKaiser,4400.0,1 year 
"“Kiss the Boer” is free speech: Afriforum vs Julius Malema, Adv Malesela Teffo, SA Constitution",29000.0,1 year 
"Should South Africa arrest Putin? BRICS, Russia-Ukraine, Lady R, Geopolitics, SA foreign policy",18000.0,1 year 
"""SA in an economic disaster"": SARB repo rate hikes, Eskom debt, Basic Income Grant, GDP",34000.0,1 year 
"50K SUBSCRIBERS Q&A: Liverpool, Marriage, SABC Show, 2024 Elections, Academic Tips",6900.0,1 year 
"""Stage 6 is Breaking SA"": Andre de Ruyter, Makhadzi v Open Mic, Joburg Coalitions, Eskom corruption",24000.0,1 year 
"Mbeki guns for Ramaphosa: Phala Phala, Eskom, De Ruyter and the Constitution",148000.0,1 year 
"""Media attacks on me were unfair"": UCT departure, CODESA failures, student protests and fees",139000.0,1 year 
"""SA Constitution must be rewritten"": Race and the law, threats to Black advocates, ANC failures",308000.0,1 year 
"Was ""national shutdown"" justified? | Apartheid's legacy, privatisation debate, law & media in SA",32000.0,1 year 
"""Our Leaders Disappointed"" | The Hustlers Corner, MacG & Black Coffee on fame, MOFAYA, Zahara",39000.0,1 year 
"“Helen Zille Could be President” | Cabinet Reshuffle, Andre de Ruyter, Phala Phala, 2024 Election",140000.0,1 year 
"“The Rainbow Nation Was a Scam” | Racism in SA, Eskom Crisis, SA Constitution, Gender Justice",43000.0,1 year 
"""SA Needs a Reset"" | Operation Dudula, Eskom Crisis, Cyril Ramaphosa, EFF Parliament, 2024 Election",302000.0,1 year 
"""No one listens to Cyril anymore"" | DJ Sbu, MacG, Ramaphosa, SONA 2023, Rob Hersov, The Penuel Show",142000.0,1 year 
"""DA Will Fight Phala Phala"" I SONA 2023 | Steenhuisen vs Phalatse I Women in Politics",11000.0,1 year 
"""Eskom's a disaster"" l Cabinet Reshuffle? I David Mabuza vs Paul Mashatile | Nasrec | SONA 2023",39000.0,1 year 
"""SA is in crisis"" I Interview with Cyril Ramaphosa l Loadshedding | Mogoeng Mogoeng | 2024 Election",211000.0,1 year 
Ramaphosa vs Parliament l Phala Phala at Concourt l ANC 55th National Conference Nasrec,22000.0,2 years 
"""Cyril Ramaphosa should resign"" I Phala Phala Panel report I ANC NEC vs Parliament",38000.0,2 years 
“ANC must renew or die” I ANC Conference I Phala Phala | Janus Walusz I Spirituality,53000.0,2 years 
"""Mashatile can beat Ramaphosa"" I ANC Conference 2022 I Ramaphosa vs Mkhize | Thabo Mbeki",19000.0,2 years 
“I am a fighter” I Joburg Mayor Court Ruling | Joburg Coalitions | ANC v EFF — Dr Mpho Phalatse,14000.0,2 years 
"""iDiskiTV saved my life"" I How to Build a YouTube Channel | Cyril Ramaphosa | Nkululeko n Culture",28000.0,2 years 
“I Can be Gauteng Premier” I How the Joburg Coalition Fell | DA vs ActionSA — Bongani Baloyi,9600.0,2 years 
“Why I left the DA” l How to create a new politics | John Steenhuisen | Service Delivery,6600.0,2 years 
ANC Conference Latest: Mkhize vs Ramaphosa | Paul Mashatile | KZN Dynamics | Gwede Mantashe,8400.0,2 years 
Minister Kubayi: Running for ANC DP I Rob Hersov | Ramaphosa 2nd Term,3600.0,2 years 
Phala Phala Scandal: Latest Developments l Impeachment Inquiry,7900.0,2 years 
Marikana: ten years on,2500.0,2 years 
